325,1612590106906,661,Bay Area Technology,Oakland Unified,Oakland Unified School District (OUSD),Alameda,Magnolia Educational and Research Foundation,,Site Based,Start up
326,1612590100065,510,Oakland Unity High,Oakland Unified,Oakland Unified School District (OUSD),Alameda,,,Site Based,Start up
327,1612590100123,499,East Oakland Leadership Academy,Oakland Unified,Oakland Unified School District (OUSD),Alameda,East Oakland Leadership Academies,,Site Based,Start up
328,1613090101212,524,KIPP Summit Academy,San Lorenzo Unified,San Lorenzo Unified School District,Alameda,KIPP Bay Area Schools,,Site Based,Start up
329,1612593030772,340,Oakland School for the Arts,Oakland Unified,Oakland Unified School District (OUSD),Alameda,,,Site Based,Start up
330,1612590130666,465,Aspire Lionel Wilson College Preparatory Academy,Oakland Unified,Oakland Unified School District (OUSD),Alameda,Aspire Public Schools,,Site Based,Start up
331,1612596118608,1443,ASCEND,Oakland Unified,Oakland Unified School District (OUSD),Alameda,Education for Change,,Site Based,Conversion
332,1611190130625,398,Alternatives in Action,Alameda Unified,Alameda Unified School District (AUSD),Alameda,,,Site Based,Start up
333,1612590130633,413,Lighthouse Community Charter,Oakland Unified,Oakland Unified School District (OUSD),Alameda,Lighthouse Community Public Charter Schools,,Site Based,Start up
334,1611190130609,352,Alameda Community Learning Center,Alameda Unified,Alameda Unified School District (AUSD),Alameda,Community Learning Center Schools,,Site Based,Conversion
335,1612590130617,349,"Oakland Military Institute, College Preparatory Academy",Oakland Unified,Oakland Unified School District (OUSD),Alameda,,,Site Based,Start up
336,1612596117568,252,Aspire Monarch Academy,Oakland Unified,Oakland Unified School District (OUSD),Alameda,Aspire Public Schools,,Site Based,Start up
337,1612596117972,302,North Oakland Community Charter,Oakland Unified,Oakland Unified School District (OUSD),Alameda,,,Site Based,Start up
338,1612596113807,106,American Indian Public Charter,Oakland Unified,Oakland Unified School District (OUSD),Alameda,The American Indian Model (AIM),,Site Based,Start up
339,1612596111660,14,Oakland Charter Academy,Oakland Unified,Oakland Unified School District (OUSD),Alameda,Amethod Public Schools Inc.,,Site Based,Start up
340,1100176002000,1464,Lazear Charter Academy,Alameda County Office of Education,Oakland Unified School District (OUSD),Alameda,Education for Change,,Site Based,Conversion
341,1100176001788,740,Cox Academy,Alameda County Office of Education,Oakland Unified School District (OUSD),Alameda,Education for Change,,Site Based,Conversion
342,7617960129643,1660,Richmond Charter Elementary-Benito Juarez,West Contra Costa Unified,West Contra Costa Unified School District,Contra Costa,Amethod Public Schools Inc.,,Site Based,Start up
343,7100740129528,1622,Caliber: Beta Academy,Contra Costa County Office of Education,West Contra Costa Unified School District,Contra Costa,Caliber Schools,,Site Based,Start up
344,7100740129684,1650,Summit Public School K2,Contra Costa County Office of Education,West Contra Costa Unified School District,Contra Costa,Summit Public Schools,,Site Based,Start up
345,7617960126805,1441,Richmond Charter Academy,West Contra Costa Unified,West Contra Costa Unified School District,Contra Costa,Amethod Public Schools Inc.,,Site Based,Start up
346,7768100125815,1372,Synergy,SBE - Synergy,Pittsburg Unified School District,Contra Costa,,,Site Based,Start up
347,7100740114470,868,Making Waves Academy,Contra Costa County Office of Education,West Contra Costa Unified School District,Contra Costa,,,Site Based,Start up
348,7616480115063,909,Antioch Charter Academy II,Antioch Unified,Antioch Unified School District,Contra Costa,Antioch Charter Academies,,Site Based,Start up
349,7617960110973,755,Richmond College Preparatory,West Contra Costa Unified,West Contra Costa Unified School District,Contra Costa,,,Site Based,Start up
350,7617960101477,557,Leadership Public Schools: Richmond,West Contra Costa Unified,West Contra Costa Unified School District,Contra Costa,Leadership Public Schools,,Site Based,Start up
351,7617546118087,305,Eagle Peak Montessori,Mt. Diablo Unified,Mt. Diablo Unified School District,Contra Costa,,,Site Based,Start up
352,7617966118368,333,Manzanita Middle,West Contra Costa Unified,West Contra Costa Unified School District,Contra Costa,,,Site Based,Start up
353,7616486115703,143,Antioch Charter Academy,Antioch Unified,Antioch Unified School District,Contra Costa,Antioch Charter Academies,,Site Based,Start up
354,7100740731380,1400,Clayton Valley Charter High,Contra Costa County Office of Education,Mount Diablo Unified School District,Contra Costa,,,Site Based,Conversion
355,12626790127266,1496,Redwood Coast Montessori,Arcata Elementary,Arcata Elementary School District,Humboldt,,,Site Based,Start up
356,12768020124164,1304,Redwood Preparatory Charter,Fortuna Elementary,Fortuna Elementary School District,Humboldt,,,Site Based,Start up
357,12101240115097,930,Northcoast Preparatory and Performing Arts Academy,Humboldt County Office of Education,Northern Humboldt Union High School District,Humboldt,,,Site Based,Start up
358,12629760115154,891,Trillium Charter,Pacific Union Elementary,Pacific Union Elementary School District,Humboldt,,,Site Based,Start up
359,12626790111708,769,Union Street Charter,Arcata Elementary,Arcata Elementary School District,Humboldt,,,Site Based,Start up
360,12626790109975,744,Fuente Nueva Charter,Arcata Elementary,Arcata Elementary School District,Humboldt,,,Site Based,Start up
361,12628286116289,173,Freshwater Charter Middle,Freshwater Elementary,Freshwater Elementary School District,Humboldt,,,Site Based,Start up
362,12628936007959,D8,Jacoby Creek,Jacoby Creek Elementary,Jacoby Creek Elementary School District,Humboldt,,,Site Based,Conversion
363,17640140130989,1683,Intermountain STEM Academy Charter,Kelseyville Unified,Kelseyville Unified School District,Lake,,,Site Based,Start up
364,17640550108340,681,Lake County International Charter,Middletown Unified,Middletown Unified School District,Lake,,,Site Based,Start up
365,21102152130102,87,Phoenix Academy,Marin County Office of Education,San Rafael City High School District,Marin,,,Site Based,Conversion
366,21654746118491,351,Willow Creek Academy,Sausalito Marin City,Sausalito Marin City Elementary School District,Marin,,,Site Based,Start up
367,21654176113229,89,Novato Charter,Novato Unified,Novato Unified School District,Marin,,,Site Based,Start up
368,23656230125658,1373,Willits Elementary Charter,Willits Unified,Willits Unified School District,Mendocino,Willits Charter Schools,,Site Based,Start up
369,23656150115055,910,River Oak Charter,Ukiah Unified,Ukiah Unified School District,Mendocino,Twin Ridges Elementary School District,,Site Based,Start up
370,23656152330454,439,Accelerated Achievement Academy,Ukiah Unified,Ukiah Unified School District,Mendocino,Charter Academy of the Redwoods,,Site Based,Start up
371,23656156117386,276,Tree of Life Charter,Ukiah Unified,Ukiah Unified School District,Mendocino,,,Site Based,Start up
372,23656152330413,271,Redwood Academy of Ukiah,Ukiah Unified,Ukiah Unified School District,Mendocino,Charter Academy of the Redwoods,,Site Based,Start up
373,23656232330363,166,Willits Charter,Willits Unified,Willits Unified School District,Mendocino,Willits Charter Schools,,Site Based,Start up
374,23655576116669,192,Pacific Community Charter,Arena Union Elementary,Arena Union Elementary School District,Mendocino,,,Site Based,Start up
375,23656072330272,32,Eel River Charter,Round Valley Unified,Round Valley Unified School District,Mendocino,,,Site Based,Start up
376,27660920129239,1621,Dual Language Academy of the Monterey Peninsula,Monterey Peninsula Unified,Monterey Peninsula Unified School District,Monterey,,,Site Based,Conversion
377,27102720125765,1392,Millennium Charter High,Monterey County Office of Education,Salinas Union High School District,Monterey,,,Site Based,Start up
378,27102720124297,1306,Bay View Academy,Monterey County Office of Education,Monterey Peninsula Unified School District,Monterey,,,Site Based,Start up
379,27102720112177,799,Monterey Bay Charter,Monterey County Office of Education,Pacific Grove Unified School District,Monterey,,,Site Based,Start up
380,27659616119663,412,Oasis Charter Public,Alisal Union,Alisal Union School District,Monterey,,,Site Based,Start up
381,27660926118962,429,International School of Monterey,Monterey Peninsula Unified,Monterey Peninsula Unified School District,Monterey,,,Site Based,Start up
382,28662660108605,679,Stone Bridge,Napa Valley Unified,Napa Valley Unified School District,Napa,,,Site Based,Start up
383,28662666113302,91,River Charter,Napa Valley Unified,Napa Valley Unified School District,Napa,,,Site Based,Start up
384,28662666026983,167,Napa Valley Language Academy,Napa Valley Unified,Napa Valley Unified School District,Napa,,,Site Based,Conversion
385,35674700127688,1507,Hollister Prep,Hollister,Hollister Elementary School District,San Benito,Navigator Public Schools,,Site Based,Start up
386,38684780127530,1502,KIPP San Francisco College Preparatory,San Francisco Unified,San Francisco Unified School District (SFUSD),San Francisco,KIPP Bay Area Schools,,Site Based,Start up
387,38767520123505,1270,Mission Preparatory,SBE - Mission Preparatory,San Francisco Unified School District (SFUSD),San Francisco,,,Site Based,Start up
388,38684780123265,1267,Gateway Middle,San Francisco Unified,San Francisco Unified School District (SFUSD),San Francisco,Gateway Public Charter Schools,,Site Based,Start up
389,38684780118133,1029,Five Keys Adult School (SF Sheriff's),San Francisco Unified,San Francisco Unified School District (SFUSD),San Francisco,Five Keys Public Schools,,Site Based,Start up
390,38684780107300,599,City Arts and Tech High,San Francisco Unified,San Francisco Unified School District (SFUSD),San Francisco,Envision Schools,,Site Based,Start up
391,38684780101774,567,Five Keys Charter (SF Sheriff's),San Francisco Unified,San Francisco Unified School District (SFUSD),San Francisco,Five Keys Public Schools,,Site Based,Start up
392,38684780101352,551,KIPP San Francisco Bay Academy,San Francisco Unified,San Francisco Unified School District (SFUSD),San Francisco,KIPP Bay Area Schools,,Site Based,Start up
393,38684780101337,549,KIPP Bayview Academy,San Francisco Unified,San Francisco Unified School District (SFUSD),San Francisco,KIPP Bay Area Schools,,Site Based,Start up
394,38684783830429,140,Life Learning Academy Charter,San Francisco Unified,San Francisco Unified School District (SFUSD),San Francisco,,,Site Based,Start up
395,38684783830437,141,Gateway High,San Francisco Unified,San Francisco Unified School District (SFUSD),San Francisco,Gateway Public Charter Schools,,Site Based,Start up
396,38684786040935,158,Edison Charter Academy,San Francisco Unified,San Francisco Unified School District (SFUSD),San Francisco,,,Site Based,Conversion
397,38684783830411,122,Leadership High,San Francisco Unified,San Francisco Unified School District (SFUSD),San Francisco,,,Site Based,Start up
398,38684786112601,40,Creative Arts Charter,San Francisco Unified,San Francisco Unified School District (SFUSD),San Francisco,,,Site Based,Start up
399,40688250125807,1395,Almond Acres Charter Academy,San Miguel Joint Union,San Miguel Joint Union Elementary School District,San Luis Obispo,,,Site Based,Start up
400,40688096043194,93,Bellevue-Santa Fe Charter,San Luis Coastal Unified,San Luis Coastal Unified School District,San Luis Obispo,,,Site Based,Conversion
401,41690470129759,1647,Design Tech High,San Mateo Union High,San Mateo Union High School District,San Mateo,,,Site Based,Start up
402,41689240127548,1500,Summit Public School: Shasta,Jefferson Union High,Jefferson Union High School District,San Mateo,Summit Public Schools,,Site Based,Start up
403,41690050127282,1498,Connect Community Charter,Redwood City Elementary,Redwood City Elementary School District,San Mateo,,,Site Based,Start up
404,41690620126722,1446,East Palo Alto Academy,Sequoia Union High,Sequoia Union High School District,San Mateo,Stanford Schools Corporation,,Site Based,Start up
405,41690620112722,835,Summit Preparatory Charter High,Sequoia Union High,Sequoia Union High School District,San Mateo,Summit Public Schools,,Site Based,Start up
406,41690216044770,329,Tierra Linda Middle,San Carlos Elementary,San Carlos Elementary School District,San Mateo,,,Site Based,Conversion
407,41689996114953,125,Aspire East Palo Alto Charter,Ravenswood City Elementary,Ravenswood City Elementary School District,San Mateo,Aspire Public Schools,,Site Based,Start up
408,41690216112213,1,San Carlos Charter Learning Center,San Carlos Elementary,San Carlos Elementary School District,San Mateo,,,Site Based,Start up
409,41690216044788,330,White Oaks Elementary,San Carlos Elementary,San Carlos Elementary School District,San Mateo,,,Site Based,Conversion
410,41690216044739,260,Brittan Acres Elementary,San Carlos Elementary,San Carlos Elementary School District,San Mateo,,,Site Based,Conversion
411,41690216044754,259,Heather Elementary,San Carlos Elementary,San Carlos Elementary School District,San Mateo,,,Site Based,Conversion
412,43104390131110,1687,Rocketship Fuerza Community Prep,Santa Clara County Office of Education,Alum Rock Union Elementary School District (ARUESD),Santa Clara,Rocketship Education,,Site Based,Start up
413,43696660129718,1623,Downtown College Preparatory Middle,San Jose Unified,San Jose Unified School District,Santa Clara,Downtown College Prep Charter Schools,,Site Based,Start up
414,43694270130856,1681,Luis Valdez Leadership Academy,East Side Union High,East Side Union High School District (ESUHSD),Santa Clara,The National Hispanic University Foundation,,Site Based,Start up
415,43693690129924,1609,Kipp Prize Preparatory Academy,Alum Rock Union Elementary,Alum Rock Union Elementary School District (ARUESD),Santa Clara,KIPP Bay Area Schools,,Site Based,Start up
416,43694500129205,1608,KIPP Heritage Academy,Franklin-McKinley Elementary,Franklin-McKinley Elementary School District,Santa Clara,KIPP Bay Area Schools,,Site Based,Start up
417,43104390129213,1618,Alpha: Jose Hernandez Middle,Santa Clara County Office of Education,East Side Union High School District (ESUHSD),Santa Clara,Alpha Public Schools,,Site Based,Start up
418,43693690129254,1544,ACE Alum Rock,Alum Rock Union Elementary,Alum Rock Union Elementary School District (ARUESD),Santa Clara,,,Site Based,Start up
419,43694500129247,1545,ACE Franklin McKinley,Franklin-McKinley Elementary,Franklin-McKinley Elementary School District,Santa Clara,ACE Public Charter Schools,,Site Based,Start up
420,43104390127969,1547,Discovery Charter II,Santa Clara County Office of Education,Moreland Elementary School District,Santa Clara,Discovery Charter Schools,,Site Based,Start up
421,43104390128090,1516,Summit Public School: Denali,Santa Clara County Office of Education,Fremont Union High School District,Santa Clara,Summit Public Schools,,Site Based,Start up
422,43694500128108,1526,Rocketship Spark Academy,Franklin-McKinley Elementary,Franklin-McKinley Elementary School District,Santa Clara,Rocketship Education,,Site Based,Start up
423,43693690125526,1375,Alpha: Blanca Alvarado Middle,Alum Rock Union Elementary,Alum Rock Union Elementary School District (ARUESD),Santa Clara,Alpha Public Schools,,Site Based,Start up
424,43694270125617,1387,ACE Charter High,East Side Union High,East Side Union High School District (ESUHSD),Santa Clara,ACE Public Charter Schools,,Site Based,Start up
425,43104390125799,1394,Rocketship Alma Academy,Santa Clara County Office of Education,San Jose Unified School District,Santa Clara,Rocketship Education,,Site Based,Start up
426,43104390125781,1393,Rocketship Academy Brilliant Minds,Santa Clara County Office of Education,Alum Rock Union Elementary School District (ARUESD),Santa Clara,Rocketship Education,,Site Based,Start up
427,43104390121780,1209,Silicon Valley Flex Academy,Santa Clara County Office of Education,Morgan Hill Unified School District,Santa Clara,Flex Public Schools,,Site Based,Start up
428,43104390123281,1193,Rocketship Discovery Prep,Santa Clara County Office of Education,San Jose Unified School District,Santa Clara,Rocketship Education,,Site Based,Start up
429,43694500123299,1192,Rocketship Mosaic Elementary,Franklin-McKinley Elementary,Franklin-McKinley Elementary School District,Santa Clara,Rocketship Education,,Site Based,Start up
430,43104390123257,1268,Downtown College Prep - Alum Rock,Santa Clara County Office of Education,East Side Union High School District (ESUHSD),Santa Clara,Downtown College Prep Charter Schools,,Site Based,Start up
431,43694270123745,1276,Summit Public School: Rainier,East Side Union High,East Side Union High School District (ESUHSD),Santa Clara,Summit Public Schools,,Site Based,Start up
432,43104390123794,1282,Summit Public School: Tahoma,Santa Clara County Office of Education,East Side Union High School District (ESUHSD),Santa Clara,Summit Public Schools,,Site Based,Start up
433,43694840123760,1278,Gilroy Prep School (Navigators School),Gilroy Unified,Gilroy Unified School District,Santa Clara,Navigator Public Schools,,Site Based,Start up
434,43104390120642,1127,Rocketship Los Suenos Academy,Santa Clara County Office of Education,Palo Alto Unified School District,Santa Clara,Rocketship Education,,Site Based,Start up
435,43694500121483,1167,Cornerstone Academy Preparatory,Franklin-McKinley Elementary,Franklin-McKinley Elementary School District,Santa Clara,Building Excellent Schools,,Site Based,Start up
436,43104390120261,1116,Magnolia Science Academy Santa Clara,Santa Clara County Office of Education,Santa Clara Unified School District,Santa Clara,Magnolia Educational and Research Foundation,,Site Based,Start up
437,43104390119024,1061,Rocketship Si Se Puede Academy,Santa Clara County Office of Education,Alum Rock Union Elementary School District (ARUESD),Santa Clara,Rocketship Education,,Site Based,Start up
438,43104390116814,972,ACE Empower Academy,Santa Clara County Office of Education,East Side Union High School District (ESUHSD),Santa Clara,ACE Public Charter Schools,,Site Based,Start up
439,43694270116889,976,KIPP San Jose Collegiate,East Side Union High,East Side Union High School District (ESUHSD),Santa Clara,KIPP Bay Area Schools,,Site Based,Start up
440,43694500113662,846,Voices College-Bound Language Academy,Franklin-McKinley Elementary,Franklin-McKinley Elementary School District,Santa Clara,Voices College-Bound Language Academies,,Site Based,Start up
441,43104390113431,844,University Preparatory Academy Charter,Santa Clara County Office of Education,San Jose Unified School District,Santa Clara,,,Site Based,Start up
442,43104390113704,850,Rocketship Mateo Sheedy Elementary,Santa Clara County Office of Education,San Jose Unified School District,Santa Clara,Rocketship Education,,Site Based,Start up
443,43104390111880,767,Discovery Charter,Santa Clara County Office of Education,Moreland Elementary School District,Santa Clara,Discovery Charter Schools,,Site Based,Start up
444,43693930106005,817,Village,Campbell Union,Campbell Union Elementary School District,Santa Clara,,,Site Based,Conversion
445,43104390102905,611,Leadership Public Schools - San Jose,Santa Clara County Office of Education,East Side Union High School District (ESUHSD),Santa Clara,Leadership Public Schools,,Site Based,Start up
446,43693690106633,628,KIPP Heartwood Academy,Alum Rock Union Elementary,Alum Rock Union Elementary School District (ARUESD),Santa Clara,KIPP Bay Area Schools,,Site Based,Start up
447,43104390106534,615,Bullis Charter,Santa Clara County Office of Education,Los Altos Elementary School District,Santa Clara,,,Site Based,Start up
448,43694270107151,646,"Escuela Popular/Center for Training and Careers, Family Learning",East Side Union High,East Side Union High School District (ESUHSD),Santa Clara,Escuela Popular Public Schools,,Site Based,Start up
449,43694274330726,502,Escuela Popular Accelerated Family Learning,East Side Union High,East Side Union High School District (ESUHSD),Santa Clara,Escuela Popular Public Schools,,Site Based,Start up
450,43694274330676,425,San Jose Conservation Corps Charter,East Side Union High,East Side Union High School District (ESUHSD),Santa Clara,,,Site Based,Start up
451,43695836118541,363,Charter School of Morgan Hill,Morgan Hill Unified,Morgan Hill Unified School District,Santa Clara,,,Site Based,Start up
452,43694274330668,414,Latino College Preparatory Academy,East Side Union High,East Side Union High School District (ESUHSD),Santa Clara,The National Hispanic University Foundation,,Site Based,Start up
453,43696664330585,287,Downtown College Preparatory,San Jose Unified,San Jose Unified School District,Santa Clara,Downtown College Prep Charter Schools,,Site Based,Start up
454,43693936046692,304,Sherman Oaks Elementary,Campbell Union,Campbell Union Elementary School District,Santa Clara,,,Site Based,Conversion
455,43696176048045,1243,Ida Jew Academies,Mt. Pleasant Elementary,Mt. Pleasant Elementary School District,Santa Clara,,,Site Based,Conversion
456,43694506047229,1220,Bridges Academy,Franklin-McKinley Elementary,Franklin-McKinley Elementary School District,Santa Clara,,,Site Based,Conversion
457,43693936046544,866,Castlemont Elementary,Campbell Union,Campbell Union Elementary School District,Santa Clara,,,Site Based,Conversion
458,43693936046510,993,Blackford Elementary,Campbell Union,Campbell Union Elementary School District,Santa Clara,,,Site Based,Conversion
459,43693936046619,984,Marshall Lane Elementary,Campbell Union,Campbell Union Elementary School District,Santa Clara,,,Site Based,Conversion
460,43693936046668,887,Rolling Hills Middle,Campbell Union,Campbell Union Elementary School District,Santa Clara,,,Site Based,Conversion
461,43693856046494,497,Sartorette Charter,Cambrian,Cambrian Elementary School District,Santa Clara,,,Site Based,Conversion
462,43693936046627,899,Monroe Middle,Campbell Union,Campbell Union Elementary School District,Santa Clara,,,Site Based,Conversion
463,43693856046452,574,Farnham Charter,Cambrian,Cambrian Elementary School District,Santa Clara,,,Site Based,Conversion
464,43693936046676,994,Rosemary Elementary,Campbell Union,Campbell Union Elementary School District,Santa Clara,,,Site Based,Conversion
465,43693936046601,865,Lynhaven Elementary,Campbell Union,Campbell Union Elementary School District,Santa Clara,,,Site Based,Conversion
466,43693936046536,886,Capri Elementary,Campbell Union,Campbell Union Elementary School District,Santa Clara,,,Site Based,Conversion
467,43693856046445,638,Fammatre Elementary,Cambrian,Cambrian Elementary School District,Santa Clara,,,Site Based,Conversion
468,43696666048730,980,Walter L. Bachrodt Elementary,San Jose Unified,San Jose Unified School District,Santa Clara,,,Site Based,Conversion
469,43693936046577,997,Forest Hill Elementary,Campbell Union,Campbell Union Elementary School District,Santa Clara,,,Site Based,Conversion
470,43693856046486,575,Price Charter Middle,Cambrian,Cambrian Elementary School District,Santa Clara,,,Site Based,Conversion
471,43693696046247,1521,Aptitud Community Academy at Goss,Alum Rock Union Elementary,Alum Rock Union Elementary School District (ARUESD),Santa Clara,,,Site Based,Conversion
472,44697990117804,1004,Ceiba College Preparatory Academy,Pajaro Valley Unified,Pajaro Valley Unified School District,Santa Cruz,Ceiba Public Schools,,Site Based,Start up
473,44697650100388,513,Tierra Pacifica Charter,Live Oak Elementary,Live Oak Elementary School District,Santa Cruz,,,Site Based,Start up
474,44697650100305,512,Cypress Charter High,Live Oak Elementary,Live Oak Elementary School District,Santa Cruz,,,Site Based,Start up
475,44697996119077,373,Watsonville Charter School of the Arts,Pajaro Valley Unified,Pajaro Valley Unified School District,Santa Cruz,,,Site Based,Start up
476,44104474430252,210,Pacific Collegiate Charter,Santa Cruz County Office of Education,Santa Cruz City High School District,Santa Cruz,,,Site Based,Start up
477,44697994430245,265,Academic/Vocational Charter Institute,Pajaro Valley Unified,Pajaro Valley Unified School District,Santa Cruz,,,Site Based,Start up
478,44698234430187,59,Delta Charter,Santa Cruz City High,Santa Cruz City High School District,Santa Cruz,,,Site Based,Start up
479,44697996049720,41,Linscott Charter,Pajaro Valley Unified,Pajaro Valley Unified School District,Santa Cruz,,,Site Based,Start up
480,44697996049829,164,Alianza Charter,Pajaro Valley Unified,Pajaro Valley Unified School District,Santa Cruz,,,Site Based,Conversion
481,48705730129494,1635,Kairos Public School Vacaville Academy,Vacaville Unified,Vacaville Unified School District,Solano,Guajome Public Charter Schools,,Site Based,Start up
482,48705730122523,1261,Alternative Cooperative Education Charter,Vacaville Unified,Vacaville Unified School District,Solano,,,Site Based,Start up
483,48705810115469,940,Vallejo Charter,Vallejo City Unified,Vallejo City Unified School District,Solano,,,Site Based,Start up
484,48705814830196,372,MIT Academy,Vallejo City Unified,Vallejo City Unified School District,Solano,Mare Island Technology (MIT) Public Schools,,Site Based,Start up
485,48705816116255,181,Mare Island Technology Academy,Vallejo City Unified,Vallejo City Unified School District,Solano,Mare Island Technology (MIT) Public Schools,,Site Based,Start up
486,48705734830113,56,Elise P. Buckingham Charter Magnet High,Vacaville Unified,Vacaville Unified School District,Solano,,,Site Based,Start up
487,48705736051338,913,Fairmont Charter Elementary,Vacaville Unified,Vacaville Unified School District,Solano,,,Site Based,Conversion
488,49708470127555,1579,Loma Vista Immersion Academy,Old Adobe Union,Old Adobe Union Elementary School District,Sonoma,,,Site Based,Start up
