802,19647336019392,1476,Superior Street Elementary,Los Angeles Unified,Los Angeles Unified School District (LAUSD),Los Angeles,,,Site Based,Conversion
803,19647330106427,636,Synergy Charter Academy,Los Angeles Unified,Los Angeles Unified School District (LAUSD),Los Angeles,Synergy Academies,,Site Based,Start up
804,19646346014518,1591,La Tijera K-8 Academy of Excellence,Inglewood Unified,Inglewood Unified School District,Los Angeles,,,Site Based,Conversion
805,19647330117895,1014,Synergy Kinetic Academy,Los Angeles Unified,Los Angeles Unified School District (LAUSD),Los Angeles,Synergy Academies,,Site Based,Start up
806,19647330124560,1299,Synergy Quantum Academy,Los Angeles Unified,Los Angeles Unified School District (LAUSD),Los Angeles,Synergy Academies,,Site Based,Start up
807,19647330122242,1206,TEACH Academy of Technologies,Los Angeles Unified,Los Angeles Unified School District (LAUSD),Los Angeles,"TEACH, Inc.",,Site Based,Start up
808,19647330129627,1658,TEACH Tech Charter High,Los Angeles Unified,Los Angeles Unified School District (LAUSD),Los Angeles,"TEACH, Inc.",,Site Based,Start up
809,14101400128447,1594,The Education Corps,Inyo County Office of Education,Los Angeles Unified School District (LAUSD),Inyo,Los Angeles Education Corps.,,Site Based,Start up
810,19767370102020,597,Today's Fresh Start Charter,SBE - Today's Fresh Start Charter,Los Angeles Unified School District (LAUSD),Los Angeles,Today's Fresh Start Public Charter Schools,,Site Based,Start up
811,19647336019525,230,Topanga Elementary Charter,Los Angeles Unified,Los Angeles Unified School District (LAUSD),Los Angeles,Palisades Charter Schools Foundation,,Site Based,Conversion
812,19647336019533,1475,Topeka Charter School For Advanced Studies,Los Angeles Unified,Los Angeles Unified School District (LAUSD),Los Angeles,,,Site Based,Conversion
813,42692290116921,973,Manzanita Public Charter,Lompoc Unified,Lompoc Unified School District,Santa Barbara,,,Site Based,Start up
814,42691796118434,337,Santa Ynez Valley Charter,College Elementary,College Elementary School District,Santa Barbara,,,Site Based,Start up
815,42767866118202,326,Adelante Charter,Santa Barbara Unified,Santa Barbara Unified School District,Santa Barbara,,,Site Based,Start up
816,42767866045918,21,Peabody Charter,Santa Barbara Unified,Santa Barbara Unified School District,Santa Barbara,,,Site Based,Conversion
817,56105610121756,1203,BRIDGES Charter,Ventura County Office of Education,Conejo Valley Unified School District,Ventura,,,Site Based,Start up
818,56725460120634,1126,"Architecture, Construction & Engineering Charter High (ACE)",Oxnard Union High,Oxnard Union High School District,Ventura,,,Site Based,Start up
819,56105616055974,1072,Meadows Arts and Technology Elementary,Ventura County Office of Education,Conejo Valley Unified School District,Ventura,,,Site Based,Conversion
820,56725460115105,943,Camarillo Academy of Progressive Education,Oxnard Union High,Oxnard Union High School District,Ventura,,,Site Based,Start up
821,56105610112417,805,Ventura Charter School of Arts and Global Education,Ventura County Office of Education,Ventura Unified School District,Ventura,Ventura County Schools Business Services Authority,,Site Based,Start up
822,56725530111690,771,University Charter Middle School at CSU Channel Islands,Pleasant Valley,Pleasant Valley Elementary School District,Ventura,University Preparatory Public Charters at CSU Channel Islands,,Site Based,Start up
823,56725536120620,464,University Preparation School at CSU Channel Islands,Pleasant Valley,Pleasant Valley Elementary School District,Ventura,University Preparatory Public Charters at CSU Channel Islands,,Site Based,Start up
824,4615070129577,1616,STREAM Charter,Oroville City Elementary,Oroville City Elementary School District,Butte,,,Site Based,Start up
825,4614240123810,1280,Wildflower Open Classroom,Chico Unified,Chico Unified School District,Butte,,,Site Based,Start up
826,4614240121475,1166,Sherwood Montessori,Chico Unified,Chico Unified School District,Butte,,,Site Based,Start up
827,4614400121509,1170,Ipakanni Early College Charter,Feather Falls Union Elementary,Feather Falls Union Elementary School District,Butte,,,Site Based,Start up
828,4614240120394,1114,Inspire School of Arts and Sciences,Chico Unified,Chico Unified School District,Butte,,,Site Based,Start up
829,4614240118042,1019,Forest Ranch Charter,Chico Unified,Chico Unified School District,Butte,,,Site Based,Start up
830,4615310110338,751,Achieve Charter School of Paradise Inc.,Paradise Unified,Paradise Unified School District,Butte,,,Site Based,Start up
831,4614240110551,729,Nord Country,Chico Unified,Chico Unified School District,Butte,,,Site Based,Start up
832,4614246119523,415,Blue Oak Charter,Chico Unified,Chico Unified School District,Butte,,,Site Based,Start up
833,4614246113773,112,Chico Country Day,Chico Unified,Chico Unified School District,Butte,,,Site Based,Start up
834,4615316113765,94,Children's Community Charter,Paradise Unified,Paradise Unified School District,Butte,Paradise Unified School District,,Site Based,Start up
835,4615316112999,79,Paradise Charter Middle,Paradise Unified,Paradise Unified School District,Butte,,,Site Based,Start up
836,9618380129965,1655,Rising Sun Montessori,Buckeye Union Elementary,Buckeye Union Elementary School District,El Dorado,,,Site Based,Start up
837,9618380111724,774,California Montessori Project-Shingle Springs Campus,Buckeye Union Elementary,Buckeye Union Elementary School District,El Dorado,California Montessori Project Administrative Offices,,Site Based,Start up
838,9618380107227,665,Charter Montessori Blue Oak Campus,Buckeye Union Elementary,Buckeye Union Elementary School District,El Dorado,,,Site Based,Start up
839,9100900930131,53,Rite of Passage,El Dorado County Office of Education,Bret Harte Union High School District,El Dorado,El Dorado County Office of Education,,Site Based,Conversion
840,10621660127514,1503,Kepler Neighborhood,Fresno Unified,Fresno Unified School District (FUSD),Fresno,,,Site Based,Start up
841,10622650126292,1513,Reedley Middle College High,Kings Canyon Joint Unified,Kings Canyon Joint Unified School District,Fresno,Kings Canyon Joint Unified School District,,Site Based,Conversion
842,10101080125260,1365,New Spirit Charter Academy,Fresno County Office of Education,Fresno Unified School District (FUSD),Fresno,,,Site Based,Start up
843,10621660121533,1172,Morris E. Dailey Charter Elementary,Fresno Unified,Fresno Unified School District (FUSD),Fresno,"Fresno Innovative Charter Schools, Inc.",,Site Based,Start up
844,10621660114553,890,University High,Fresno Unified,Fresno Unified School District (FUSD),Fresno,,,Site Based,Start up
845,10622400113142,D2,Ronald W. Reagan Elementary,Kingsburg Elementary Charter,Kingsburg Elementary School District Charter,Fresno,Kingsburg Elementary Charter School District,,Site Based,Conversion
846,10621660111633,792,Valley Arts and Science Academy (VASA),Fresno Unified,Fresno Unified School District (FUSD),Fresno,,,Site Based,Start up
847,10101080111682,787,Hume Lake Charter,Fresno County Office of Education,Kings Canyon Joint Unified School District,Fresno,,,Site Based,Start up
848,10621660106740,662,Valley Preparatory Academy Charter,Fresno Unified,Fresno Unified School District (FUSD),Fresno,,,Site Based,Start up
849,10624146117865,258,Quail Lake Environmental Charter,Sanger Unified,Sanger Unified School District,Fresno,,,Site Based,Start up
850,10624146117873,283,Sanger Academy Charter,Sanger Unified,Sanger Unified School District,Fresno,,,Site Based,Start up
851,10622406108328,D202,Rafer Johnson Junior High,Kingsburg Elementary Charter,Kingsburg Elementary School District Charter,Fresno,Kingsburg Elementary Charter School District,,Site Based,Conversion
852,10622406006720,D204,Washington Elementary,Kingsburg Elementary Charter,Kingsburg Elementary School District Charter,Fresno,Kingsburg Elementary Charter School District,,Site Based,Conversion
853,10619946005730,D5,Alvina Elementary Charter,Alvina Elementary,Alvina Elementary School District,Fresno,,,Site Based,Conversion
854,10622406006704,D2,Lincoln Elementary,Kingsburg Elementary Charter,Kingsburg Elementary School District Charter,Fresno,Kingsburg Elementary Charter School District,,Site Based,Conversion
855,10622406006712,D203,Roosevelt Elementary,Kingsburg Elementary Charter,Kingsburg Elementary School District Charter,Fresno,Kingsburg Elementary Charter School District,,Site Based,Conversion
856,10101086085112,195,Edison-Bethune Charter Academy,Fresno County Office of Education,Fresno Unified School District (FUSD),Fresno,"EdisonLearning, Inc.",,Site Based,Conversion
857,11101160130807,1676,Conservation Corps of Long Beach Gateway Cities Charter,Glenn County Office of Education,Long Beach Unified School District,Glenn,,,Site Based,Start up
858,15636280128504,1575,Peak to Peak Mountain Charter,Maricopa Unified,Maricopa Unified School District,Kern,,,Site Based,Start up
859,15101570124040,1292,Grimmway Academy,Kern County Office of Education,Arvin Union Elementary School District,Kern,,,Site Based,Start up
860,15634040120139,1109,Nueva Vista Language Academy,Delano Union Elementary,Delano Union Elementary School District,Kern,,,Site Based,Start up
861,15101570119669,1078,Paramount Academy,Kern County Office of Education,Delano Joint Union High School District,Kern,,,Site Based,Start up
862,15756301530500,350,Ridgecrest Charter,SBE - Ridgecrest Charter,Sierra Sands Unified School District,Kern,,,Site Based,Start up
863,15635291530435,71,Kern Workforce 2000 Academy,Kern High,Kern High School District,Kern,,,Site Based,Start up
864,15634046009369,1352,Del Vista Math and Science Academy,Delano Union Elementary,Delano Union Elementary School District,Kern,,,Site Based,Conversion
865,15634046009351,1184,Cecil Avenue Math and Science Academy,Delano Union Elementary,Delano Union Elementary School District,Kern,,,Site Based,Conversion
866,16639900116699,D1,Frontier Elementary,Pioneer Union Elementary,Pioneer Union Elementary School District,Kings,Pioneer Union Elementary School District,,Site Based,Start up
867,16639820110205,1068,Lemoore Middle College High,Lemoore Union High,Lemoore Union High School District,Kings,,,Site Based,Conversion
868,16639740100156,489,Lemoore University Elementary Charter,Lemoore Union Elementary,Lemoore Union Elementary School District,Kings,,,Site Based,Start up
869,16639906110233,D1,Pioneer Middle,Pioneer Union Elementary,Pioneer Union Elementary School District,Kings,Pioneer Union Elementary School District,,Site Based,Conversion
870,16639906010557,D1,Pioneer Elementary,Pioneer Union Elementary,Pioneer Union Elementary School District,Kings,Pioneer Union Elementary School District,,Site Based,Conversion
871,16639336010466,D6,Island Elementary,Island Union Elementary,Island Union Elementary School District,Kings,,,Site Based,Conversion
872,16639416010474,D7,Kings River-Hardwick Elementary,Kings River-Hardwick Union Elementary,Kings River-Hardwick Union Elementary School District,Kings,Kings River-Hardwick Union Elementary,,Site Based,Conversion
873,16639176010391,1637,Jefferson Charter Academy,Hanford Elementary,Hanford Elementary School District,Kings,,,Site Based,Conversion
874,20756060125021,1341,Minarets Charter High,Chawanakee Unified,Chawanakee Unified School District,Madera,Chawanakee Unified School District,,Site Based,Start up
875,20652430107938,676,Ezequiel Tafoya Alvarado Academy,Madera Unified,Madera Unified School District,Madera,,,Site Based,Start up
876,20652430100016,507,Sherman Thomas Charter,Madera Unified,Madera Unified School District,Madera,Sherman Thomas Public Charter Schools,,Site Based,Start up
877,20102072030229,460,Pioneer Technical Center,Madera County Office of Education,Madera Unified School District,Madera,Madera County Office of Education,,Site Based,Start up
878,22655320125823,1396,Sierra Foothill Charter,Mariposa County Unified,Mariposa County Unified School District,Mariposa,,,Site Based,Start up
879,24657550125575,1385,Green Valley Charter,Los Banos Unified,Los Banos Unified School District,Merced,Foundations Public Schools,,Site Based,Start up
880,26102640125633,1388,California Heritage Youthbuild Academy,Mono County Office of Education,Shasta Union High School District,Mono,,,Site Based,Start up
881,26102640126698,1433,Orange County Conservation Corps Charter,Mono County Office of Education,Fullerton Joint Union High School District,Mono,,,Site Based,Start up
882,26102640124990,1355,Urban Corps of San Diego County Charter,Mono County Office of Education,San Diego Unified School District (SDUSD),Mono,,,Site Based,Start up
883,29663570124834,1336,Sierra Academy of Expeditionary Learning,Nevada Joint Union High,Nevada Joint Union High School District,Nevada,,,Site Based,Start up
884,29102980130823,1680,EPIC de Cesar Chavez,Nevada County Office of Education,Tehachapi Unified School District,Nevada,,,Site Based,Start up
885,29663160125013,1339,Chicago Park Community Charter,Chicago Park Elementary,Chicago Park Elementary School District,Nevada,,,Site Based,Start up
886,29102980114322,870,Yuba River Charter,Nevada County Office of Education,Grass Valley Elementary School District,Nevada,,,Site Based,Start up
887,29102980114330,869,Nevada City School of the Arts,Nevada County Office of Education,Grass Valley Elementary School District,Nevada,,,Site Based,Start up
888,29102980114314,871,Bitney College Preparatory High,Nevada County Office of Education,Nevada Joint Union High School District,Nevada,Twin Ridges Elementary School District,,Site Based,Start up
889,29102980114975,947,Sierra Montessori Academy,Nevada County Office of Education,Pleasant Ridge Union Elementary School District,Nevada,,,Site Based,Start up
890,29102982930147,255,Muir Charter,Nevada County Office of Education,Sacramento City Unified School District (SCUSD),Nevada,,,Site Based,Start up
891,29663326111140,22,Grass Valley Charter,Grass Valley Elementary,Grass Valley Elementary School District,Nevada,Grass Valley Elementary School District,,Site Based,Start up
892,29664076027197,1576,Union Hill Elementary,Union Hill Elementary,Union Hill Elementary School District,Nevada,,,Site Based,Conversion
893,31668520127928,1528,Rocklin Academy Gateway,Newcastle Elementary,Newcastle Elementary School District,Placer,Rocklin Academies,,Site Based,Start up
894,31667870126664,1429,Alta Vista Community Charter,Auburn Union Elementary,Auburn Union Elementary School District,Placer,,,Site Based,Start up
895,31668450121418,1169,John Adams Academy,Loomis Union Elementary,Loomis Union Elementary School District,Placer,,,Site Based,Start up
896,31668860122531,1219,Weimar Hills Charter,Placer Hills Union Elementary,Placer Hills Union Elementary School District,Placer,,,Site Based,Start up
897,31669440121624,1180,Sierra Expeditionary Learning,Tahoe-Truckee Unified,Tahoe-Truckee Unified School District,Placer,,,Site Based,Start up
898,31750850117879,1042,Maria Montessori Charter Academy,Rocklin Unified,Rocklin Unified School District,Placer,,,Site Based,Start up
899,31668450117150,979,Loomis Basin Charter,Loomis Union Elementary,Loomis Union Elementary School District,Placer,,,Site Based,Start up
900,31668520109827,727,Newcastle Charter,Newcastle Elementary,Newcastle Elementary School District,Placer,,,Site Based,Start up
901,31750856118392,308,Rocklin Academy,Rocklin Unified,Rocklin Unified School District,Placer,Rocklin Academies,,Site Based,Start up
902,31667616031009,D9,Bowman Charter,Ackerman Charter,Ackerman Charter Elementary School District,Placer,,,Site Based,Conversion
903,34674390131136,1690,New Joseph Bonnheim (NJB) Community Charter,Sacramento City Unified,Sacramento City Unified School District (SCUSD),Sacramento,Sacramento City Unified School District (SCUSD),,Site Based,Start up
904,34765050130757,1674,Highlands Community Charter,Twin Rivers Unified,Twin Rivers Unified School District,Sacramento,,,Site Based,Start up
905,34674470128124,1563,Gateway International,San Juan Unified,San Juan Unified School District,Sacramento,Gateway Community Charter Schools,,Site Based,Start up
906,34674390125591,1386,Oak Park Preparatory Academy,Sacramento City Unified,Sacramento City Unified School District (SCUSD),Sacramento,St. HOPE Public Schools,,Site Based,Start up
907,34752830126060,1405,Leroy Greene Academy,Natomas Unified,Natomas Unified School District,Sacramento,,,Site Based,Start up
908,34674390123901,1273,Capitol Collegiate Academy,Sacramento City Unified,Sacramento City Unified School District (SCUSD),Sacramento,,,Site Based,Start up
909,34103480124651,1313,Fortune,Sacramento County Office of Education,Elk Grove Unified School District,Sacramento,Fortune School of Education,,Site Based,Start up
910,34752830124594,1305,Westlake Charter Middle,Natomas Unified,Natomas Unified School District,Sacramento,Westlake Public Charter Schools,,Site Based,Start up
911,34674470121467,1555,Aspire Alexander Twilight Secondary Academy,San Juan Unified,San Juan Unified School District,Sacramento,Aspire Public Schools,,Site Based,Start up
912,34674390121665,1186,Yav Pem Suab Academy - Preparing for the Future Charter,Sacramento City Unified,Sacramento City Unified School District (SCUSD),Sacramento,Urban Charter Schools Collective,,Site Based,Start up
913,34674470120469,1554,Aspire Alexander Twilight College Preparatory Academy,San Juan Unified,San Juan Unified School District,Sacramento,Aspire Public Schools,,Site Based,Start up
914,34752830120113,1106,Natomas Pacific Pathways Prep Middle,Natomas Unified,Natomas Unified School District,Sacramento,NP3 Public Schools,,Site Based,Start up
915,34674470114983,946,Golden Valley Charter School of Sacramento,San Juan Unified,San Juan Unified School District,Sacramento,,,Site Based,Start up
916,34674130114660,853,Delta Elementary Charter,River Delta Joint Unified,River Delta Joint Unified School District,Sacramento,,,Site Based,Start up
917,34765050113878,862,Higher Learning Academy,Twin Rivers Unified,Twin Rivers Unified School District,Sacramento,Gateway Community Charter Schools,,Site Based,Start up
918,34674390111757,775,California Montessori Project - Capitol Campus,Sacramento City Unified,Sacramento City Unified School District (SCUSD),Sacramento,California Montessori Project Administrative Offices,,Site Based,Start up
919,34673140111732,777,California Montessori Project - Elk Grove Campus,Elk Grove Unified,Elk Grove Unified School District,Sacramento,California Montessori Project Administrative Offices,,Site Based,Start up
920,34674470112169,776,California Montessori Project-San Juan Campus,San Juan Unified,San Juan Unified School District,Sacramento,California Montessori Project Administrative Offices,,Site Based,Start up
921,34752830112425,823,Natomas Pacific Pathways Prep,Natomas Unified,Natomas Unified School District,Sacramento,NP3 Public Schools,,Site Based,Start up
922,34752830108860,711,Westlake Charter,Natomas Unified,Natomas Unified School District,Sacramento,Westlake Public Charter Schools,,Site Based,Start up
923,34765050108795,686,Creative Connections Arts Academy,Twin Rivers Unified,Twin Rivers Unified School District,Sacramento,,,Site Based,Start up
924,34674390106898,640,The Language Academy of Sacramento,Sacramento City Unified,Sacramento City Unified School District (SCUSD),Sacramento,,,Site Based,Start up
925,34765050101832,560,Futures High,Twin Rivers Unified,Twin Rivers Unified School District,Sacramento,Gateway Community Charter Schools,,Site Based,Start up
926,34739730106377,617,Global Youth Charter,Center Joint Unified,Center Joint Unified School District,Sacramento,,,Site Based,Start up
927,34765050101766,561,Community Outreach Academy,Twin Rivers Unified,Twin Rivers Unified School District,Sacramento,Gateway Community Charter Schools,,Site Based,Start up
928,34674390101899,588,George Washington Carver School of Arts and Science,Sacramento City Unified,Sacramento City Unified School District (SCUSD),Sacramento,,,Site Based,Start up
929,34674390101881,585,New Technology High,Sacramento City Unified,Sacramento City Unified School District (SCUSD),Sacramento,New Technology Foundation,,Site Based,Start up
930,34674390102343,598,Aspire Capitol Heights Academy,Sacramento City Unified,Sacramento City Unified School District (SCUSD),Sacramento,Aspire Public Schools,,Site Based,Start up
931,34674390101907,586,The MET,Sacramento City Unified,Sacramento City Unified School District (SCUSD),Sacramento,Big Picture,,Site Based,Start up
932,34674390101048,491,St. HOPE Public School 7,Sacramento City Unified,Sacramento City Unified School District (SCUSD),Sacramento,St. HOPE Public Schools,,Site Based,Start up
933,34674390101295,552,Sol Aureus College Preparatory,Sacramento City Unified,Sacramento City Unified School District (SCUSD),Sacramento,,,Site Based,Start up
934,34674390102038,596,Sacramento Charter High,Sacramento City Unified,Sacramento City Unified School District (SCUSD),Sacramento,St. HOPE Public Schools,,Site Based,Conversion
935,34765056112643,73,Westside Preparatory Charter,Twin Rivers Unified,Twin Rivers Unified School District,Sacramento,,,Site Based,Start up
936,34674396033799,18,Bowling Green Elementary,Sacramento City Unified,Sacramento City Unified School District (SCUSD),Sacramento,,,Site Based,Conversion
937,39686270128546,1519,Acacia Middle Charter,New Jerusalem Elementary,New Jerusalem Elementary School District,San Joaquin,Tri-Valley Learning Corporation,,Site Based,Start up
938,39686270128553,1518,Acacia Elementary Charter,New Jerusalem Elementary,New Jerusalem Elementary School District,San Joaquin,Tri-Valley Learning Corporation,,Site Based,Start up
939,39686270126755,1448,"Humphreys College Academy of Business, Law and Education",New Jerusalem Elementary,New Jerusalem Elementary School District,San Joaquin,,,Site Based,Start up
940,39686760124958,1360,TEAM Charter,Stockton Unified,Stockton Unified School District,San Joaquin,,,Site Based,Start up
941,39686270124768,1328,Great Valley Academy - Manteca,New Jerusalem Elementary,New Jerusalem Elementary School District,San Joaquin,Great Valley Academies,,Site Based,Start up
942,39686760123802,1283,Health Careers Academy,Stockton Unified,Stockton Unified School District,San Joaquin,,,Site Based,Start up
943,39686760124248,1316,Pacific Law Academy,Stockton Unified,Stockton Unified School District,San Joaquin,,,Site Based,Start up
944,39686760120725,1142,Stockton Collegiate International Elementary,Stockton Unified,Stockton Unified School District,San Joaquin,Stockton Collegiate International Public Charter Schools,,Site Based,Start up
945,39686760121541,1552,Aspire APEX Academy,Stockton Unified,Stockton Unified School District,San Joaquin,Aspire Public Schools,,Site Based,Start up
946,39686760120733,1143,Stockton Collegiate International Secondary,Stockton Unified,Stockton Unified School District,San Joaquin,Stockton Collegiate International Public Charter Schools,,Site Based,Start up
947,39103970121723,1198,San Joaquin Building Futures Academy,San Joaquin County Office of Education,Stockton Unified School District,San Joaquin,San Joaquin County Office of Education,,Site Based,Start up
948,39686760119743,1083,Stockton Unified Early College Academy,Stockton Unified,Stockton Unified School District,San Joaquin,,,Site Based,Start up
949,39686760117853,1027,Dr. Lewis Dolphin Stallworth Sr. Charter,Stockton Unified,Stockton Unified School District,San Joaquin,,,Site Based,Start up
950,39686760118497,1048,Aspire Langston Hughes Academy,Stockton Unified,Stockton Unified School District,San Joaquin,Aspire Public Schools,,Site Based,Start up
951,39686760114876,1553,Aspire Port City Academy,Stockton Unified,Stockton Unified School District,San Joaquin,Aspire Public Schools,,Site Based,Start up
952,39686760111336,1197,Pittman Charter,Stockton Unified,Stockton Unified School District,San Joaquin,,,Site Based,Conversion
953,39686760108647,554,Aspire Rosa Parks Academy,Stockton Unified,Stockton Unified School District,San Joaquin,Aspire Public Schools,,Site Based,Start up
954,39754990102392,606,Millennium Charter,Tracy Joint Unified,Tracy Joint Unified School District,San Joaquin,Tracy Learning Center,,Site Based,Start up
955,39754990102384,607,Primary Charter,Tracy Joint Unified,Tracy Joint Unified School District,San Joaquin,Tracy Learning Center,,Site Based,Start up
956,39685850101956,565,Aspire Benjamin Holt College Preparatory Academy,Lodi Unified,Lodi Unified School District,San Joaquin,Aspire Public Schools,,Site Based,Start up
957,39685856118921,364,Aspire River Oaks Charter,Lodi Unified,Lodi Unified School District,San Joaquin,Aspire Public Schools,,Site Based,Start up
958,39754996118665,355,Discovery Charter,Tracy Joint Unified,Tracy Joint Unified School District,San Joaquin,Tracy Learning Center,,Site Based,Start up
959,39685856117675,288,Joe Serna Jr. Charter,Lodi Unified,Lodi Unified School District,San Joaquin,,,Site Based,Start up
960,39685856116594,178,Aspire Vincent Shalvey Academy,Lodi Unified,Lodi Unified School District,San Joaquin,Aspire Public Schools,,Site Based,Start up
961,39686766042725,1318,Nightingale Charter,Stockton Unified,Stockton Unified School District,San Joaquin,,,Site Based,Conversion
962,45752670115345,920,Redding School of the Arts II,Gateway Unified,Gateway Unified School District,Shasta,,,Site Based,Start up
963,45752670113407,849,Rocky Point Charter,Gateway Unified,Gateway Unified School District,Shasta,,,Site Based,Start up
964,45104540111674,778,Chrysalis Charter,Shasta County Office of Education,Junction Elementary School District,Shasta,,,Site Based,Start up
965,45701360106013,612,University Preparatory,Shasta Union High,Shasta Union High School District,Shasta,,,Site Based,Start up
966,45698564530333,452,Anderson New Technology High,Anderson Union High,Anderson Union High School District,Shasta,New Technology Foundation,,Site Based,Start up
